Author,Period,Work,Tokenized Text,Text,Lemmatized Text
Juvenal,Silver,Satires,"['occurrent', 'multae', 'tibi', 'belides', 'atque', 'eriphylae', 'mane', 'clytaemestram', 'nullus', 'non', 'vicus', 'habebit', 'hoc', 'tantum', 'refert', 'quod', 'tyndaris', 'illa', 'bipennem', 'insulsam', 'et', 'fatuam', 'dextra', 'laevaque', 'tenebat', 'at', 'nunc', 'res', 'agitur', 'tenui', 'pulmone', 'rubetae', 'sed', 'tamen', 'et', 'ferro', 'si', 'praegustarit', 'atrides', 'pontica', 'ter', 'victi', 'cautus', 'medicamina', 'regis', '.']",occurrent multae tibi belides atque eriphylae mane clytaemestram nullus non vicus habebit hoc tantum refert quod tyndaris illa bipennem insulsam et fatuam dextra laevaque tenebat at nunc res agitur tenui pulmone rubetae sed tamen et ferro si praegustarit atrides pontica ter victi cautus medicamina regis .,"['occurro', 'multus', 'tu', 'bonus', 'atque', 'eriphyla', 'mane', 'clytaemester', 'nullus', 'non', 'vicus', 'habeo', 'hic', 'tantum', 'refero', 'quod', 'tyndaris', 'ille', 'bipennus', 'insuluo', 'et', 'fatua', 'dexter', 'laevaque', 'teneo', 'at', 'nunc', 'res', 'ago', 'tenuus', 'pulmo', 'rubeo', 'sed', 'tamen', 'et', 'ferrum', 'si', 'praegusto', 'atris', 'ponticus', 'ter', 'victi', 'cauio', 'medicamina', 'rex', '.']"
Juvenal,Silver,Satires,"['et', 'spes', 'et', 'ratio', 'studiorum', 'in', 'caesare', 'tantum', 'solus', 'enim', 'tristes', 'hac', 'tempestate', 'camenas', 'respexit', 'cum', 'iam', 'celebres', 'notique', 'poetae', 'balneolum', 'gabiis', 'romae', 'conducere', 'furnos', 'temptarent', 'nec', 'foedum', 'alii', 'nec', 'turpe', 'putarent', 'praecones', 'fieri', 'cum', 'desertis', 'aganippes', 'vallibus', 'esuriens', 'migraret', 'in', 'atria', 'clio', 'nam', 'si', 'pieria', 'quadrans', 'tibi', 'nullus', 'in', 'umbra', 'ostendatur', 'ames', 'nomen', 'victumque', 'machaerae', 'et', 'vendas', 'potius', 'commissa', 'quod', 'auctio', 'vendit', 'stantibus', 'oenophorum', 'tripedes', 'armaria', 'cistas', 'alcitheon', 'pacti', 'thebas', 'et', 'terea', 'fausti', '.']",et spes et ratio studiorum in caesare tantum solus enim tristes hac tempestate camenas respexit cum iam celebres notique poetae balneolum gabiis romae conducere furnos temptarent nec foedum alii nec turpe putarent praecones fieri cum desertis aganippes vallibus esuriens migraret in atria clio nam si pieria quadrans tibi nullus in umbra ostendatur ames nomen victumque machaerae et vendas potius commissa quod auctio vendit stantibus oenophorum tripedes armaria cistas alcitheon pacti thebas et terea fausti .,"['et', 'spes', 'et', 'ratio', 'studium', 'in', 'caeso', 'tantum', 'solus', 'enim', 'tristis', 'hic', 'tempestas', 'camena', 'respicio', 'cum', 'iam', 'celeber', 'notiquus', 'poeta', 'balneolus', 'gabius', 'roma', 'conduco', 'furnum', 'tempto', 'nec', 'foedus', 'alius', 'nec', 'turpis', 'puto', 'praecon', 'facio', 'cum', 'desero', 'aganipp', 'vallibus', 'esurio', 'migro', 'in', 'atria', 'clius', 'nam', 'si', 'pierium', 'quadrans', 'tu', 'nullus', 'in', 'umbra', 'ostendo', 'amo', 'nomen', 'victumque', 'machaera', 'et', 'vendas', 'potius', 'committo', 'quod', 'auctio', 'vendit', 'sto', 'oenophus', 'tripes', 'armarius', 'cigo', 'alcitheon', 'pactus', 'theba', 'et', 'terea', 'faustus', '.']"
Juvenal,Silver,Satires,"['hoc', 'satius', 'quam', 'si', 'dicas', 'sub', 'iudice', 'vidi', 'quod', 'non', 'vidisti', 'faciant', 'equites', 'asiani', 'quamquam', 'et', 'cappadoces', 'faciant', 'equitesque', 'bithyni', 'altera', 'quos', 'nudo', 'traducit', 'gallia', 'talo', '.']",hoc satius quam si dicas sub iudice vidi quod non vidisti faciant equites asiani quamquam et cappadoces faciant equitesque bithyni altera quos nudo traducit gallia talo .,"['hic', 'satius', 'quam', 'si', 'dico', 'sub', 'iudex', 'vidi', 'quod', 'non', 'vidisti', 'facio', 'equitus', 'asianus', 'quamquam', 'et', 'cappadocus', 'facio', 'equiterque', 'bithynus', 'alter', 'qui', 'nudus', 'traduco', 'gallia', 'talus', '.']"
Juvenal,Silver,Satires,"['nemo', 'tamen', 'studiis', 'indignum', 'ferre', 'laborem', 'cogetur', 'posthac', 'nectit', 'quicumque', 'canoris', 'eloquium', 'vocale', 'modis', 'laurumque', 'momordit', '.']",nemo tamen studiis indignum ferre laborem cogetur posthac nectit quicumque canoris eloquium vocale modis laurumque momordit .,"['nemo', 'tamen', 'studium', 'indignus', 'fero', 'labor', 'cogo', 'posthac', 'necto', 'quicumque', 'canor', 'eloquium', 'vocale', 'modus', 'laurusque', 'momordeo', '.']"
Juvenal,Silver,Satires,"['hoc', 'agite', 'o', 'iuvenes', 'circumspicit', 'et', 'stimulat', 'vos', 'materiamque', 'sibi', 'ducis', 'indulgentia', 'quaerit', 'si', 'qua', 'aliunde', 'putas', 'rerum', 'expectanda', 'tuarum', 'praesidia', 'atque', 'ideo', 'croceae', 'membrana', 'tabellae', 'impletur', 'lignorum', 'aliquid', 'posce', 'ocius', 'et', 'quae', 'componis', 'dona', 'veneris', 'telesine', 'marito', 'aut', 'clude', 'et', 'positos', 'tinea', 'pertunde', 'libellos', 'frange', 'miser', 'calamum', 'vigilataque', 'proelia', 'dele', 'qui', 'facis', 'in', 'parva', 'sublimia', 'carmina', 'cella', 'ut', 'dignus', 'venias', 'hederis', 'et', 'imagine', 'macra', '.']",hoc agite o iuvenes circumspicit et stimulat vos materiamque sibi ducis indulgentia quaerit si qua aliunde putas rerum expectanda tuarum praesidia atque ideo croceae membrana tabellae impletur lignorum aliquid posce ocius et quae componis dona veneris telesine marito aut clude et positos tinea pertunde libellos frange miser calamum vigilataque proelia dele qui facis in parva sublimia carmina cella ut dignus venias hederis et imagine macra .,"['hic', 'ago', 'o', 'iuvenes', 'circumspico', 'et', 'stimulo', 'vos', 'materiamque', 'se', 'dux', 'indulgentia', 'quaero', 'si', 'qui', 'aliunde', 'puto', 'res', 'exspecto', 'tuus', 'praesidium', 'atque', 'ideo', 'crocea', 'membranus', 'tabella', 'impleo', 'lignum', 'aliquis', 'posce', 'ocius', 'et', 'qui', 'compono', 'donum', 'veneris', 'telesine', 'mareo', 'aut', 'cludeo', 'et', 'pono', 'tineo', 'pertus', 'libellum', 'freo', 'miser', 'calio', 'vigilataque', 'proelium', 'deleo', 'qui', 'facio', 'in', 'parva', 'sublimis', 'carmen', 'cella', 'ut', 'dignus', 'venias', 'hederus', 'et', 'imago', 'macra', '.']"
Juvenal,Silver,Satires,"['spes', 'nulla', 'ulterior', 'didicit', 'iam', 'dives', 'avarus', 'tantum', 'admirari', 'tantum', 'laudare', 'disertos', 'ut', 'pueri', 'iunonis', 'avem', '.']",spes nulla ulterior didicit iam dives avarus tantum admirari tantum laudare disertos ut pueri iunonis avem .,"['spes', 'nullus', 'ulterior', 'disco', 'iam', 'dies', 'avarus', 'tantum', 'admiror', 'tantum', 'laudo', 'disertus', 'ut', 'puer', 'iuno', 'avem', '.']"
Juvenal,Silver,Satires,"['sed', 'defluit', 'aetas', 'et', 'pelagi', 'patiens', 'et', 'cassidis', 'atque', 'ligonis', '.']",sed defluit aetas et pelagi patiens et cassidis atque ligonis .,"['sed', 'defluo', 'aetas', 'et', 'pelax', 'patiens', 'et', 'cassidus', 'atque', 'ligo', '.']"
Juvenal,Silver,Satires,"['taedia', 'tunc', 'subeunt', 'animos', 'tunc', 'seque', 'suamque', 'terpsichoren', 'odit', 'facunda', 'et', 'nuda', 'senectus', '.']",taedia tunc subeunt animos tunc seque suamque terpsichoren odit facunda et nuda senectus .,"['taedium', 'tunc', 'subeo', 'animus', 'tunc', 'seque', 'suusquis', 'terpsichoren', 'odi', 'facundus', 'et', 'nudus', 'senectus', '.']"
Juvenal,Silver,Satires,"['accipe', 'nunc', 'artes', 'ne', 'quid', 'tibi', 'conferat', 'iste', 'quem', 'colis', 'et', 'musarum', 'et', 'apollinis', 'aede', 'relicta', 'ipse', 'facit', 'versus', 'atque', 'uni', 'cedit', 'homero', 'propter', 'mille', 'annos', 'et', 'si', 'dulcedine', 'famae', 'succensus', 'recites', 'maculosas', 'commodat', 'aedes', 'haec', 'longe', 'ferrata', 'domus', 'servire', 'iubetur', 'in', 'qua', 'sollicitas', 'imitatur', 'ianua', 'portas', 'scit', 'dare', 'libertos', 'extrema', 'in', 'parte', 'sedentis', 'ordinis', 'et', 'magnas', 'comitum', 'disponere', 'voces', 'nemo', 'dabit', 'regum', 'quanti', 'subsellia', 'constant', 'et', 'quae', 'conducto', 'pendent', 'anabathra', 'tigillo', 'quaeque', 'reportandis', 'posita', 'est', 'orchestra', 'cathedris', '.']",accipe nunc artes ne quid tibi conferat iste quem colis et musarum et apollinis aede relicta ipse facit versus atque uni cedit homero propter mille annos et si dulcedine famae succensus recites maculosas commodat aedes haec longe ferrata domus servire iubetur in qua sollicitas imitatur ianua portas scit dare libertos extrema in parte sedentis ordinis et magnas comitum disponere voces nemo dabit regum quanti subsellia constant et quae conducto pendent anabathra tigillo quaeque reportandis posita est orchestra cathedris .,"['accipio', 'nunc', 'ars', 'ne', 'quis', 'tu', 'confero', 'iste', 'qui', 'colo', 'et', 'musarus', 'et', 'apollena', 'aedus', 'relinquo', 'ipse', 'facio', 'versus', 'atque', 'unus', 'cedo', 'homo', 'propter', 'mille', 'annus', 'et', 'si', 'dulcedo', 'fama', 'succinio', 'rego', 'maculosus', 'commodeo', 'aedes', 'hic', 'longe', 'ferro', 'domus', 'servire', 'iubeo', 'in', 'qui', 'sollicitus', 'imitor', 'ianua', 'porta', 'scio', 'do', 'libertos', 'exterior', 'in', 'pars', 'sedeo', 'ordo', 'et', 'magnus', 'comitum', 'dispono', 'voces', 'nemo', 'do', 'rex', 'quantus', 'subsellia', 'consto', 'et', 'qui', 'conduco', 'pendeo', 'anabotuor', 'tigillus', 'quisque', 'reporto', 'pono', 'sum', 'orchestra', 'catheder', '.']"
Juvenal,Silver,Satires,"['nos', 'tamen', 'hoc', 'agimus', 'tenuique', 'in', 'pulvere', 'sulcos', 'ducimus', 'et', 'litus', 'sterili', 'versamus', 'aratro', 'nam', 'si', 'discedas', 'laqueo', 'tenet', 'ambitiosi', 'consuetudo', 'mali', 'tenet', 'insanabile', 'multos', 'scribendi', 'cacoethes', 'et', 'aegro', 'in', 'corde', 'senescit', '.']",nos tamen hoc agimus tenuique in pulvere sulcos ducimus et litus sterili versamus aratro nam si discedas laqueo tenet ambitiosi consuetudo mali tenet insanabile multos scribendi cacoethes et aegro in corde senescit .,"['nos', 'tamen', 'hic', 'ago', 'tenuique', 'in', 'puleis', 'sulcus', 'duco', 'et', 'litus', 'sterilis', 'versamus', 'aratris', 'nam', 'si', 'discedo', 'laqueus', 'teneo', 'ambitiosus', 'consuetudo', 'malum', 'teneo', 'insanabilis', 'multus', 'scribo', 'cacoeth', 'et', 'aegrum', 'in', 'cor', 'senesco', '.']"
Juvenal,Silver,Satires,"['sed', 'vatem', 'egregium', 'cui', 'non', 'sit', 'publica', 'vena', 'qui', 'nil', 'expositum', 'soleat', 'deducere', 'nec', 'qui', 'communi', 'feriat', 'carmen', 'triviale', 'moneta', 'hunc', 'qualem', 'nequeo', 'monstrare', 'et', 'sentio', 'tantum', 'anxietate', 'carens', 'animus', 'facit', 'omnis', 'acerbi', 'inpatiens', 'cupidus', 'silvarum', 'aptusque', 'bibendis', 'fontibus', 'aonidum', '.']",sed vatem egregium cui non sit publica vena qui nil expositum soleat deducere nec qui communi feriat carmen triviale moneta hunc qualem nequeo monstrare et sentio tantum anxietate carens animus facit omnis acerbi inpatiens cupidus silvarum aptusque bibendis fontibus aonidum .,"['sed', 'vatem', 'egregius', 'qui', 'non', 'sum', 'publicus', 'vena', 'qui', 'nihil', 'expono', 'soleo', 'deduco', 'nec', 'qui', 'communis', 'fario', 'carmen', 'triviale', 'moneta', 'hic', 'qualis', 'nequeo', 'monstro', 'et', 'sentio', 'tantum', 'anxietas', 'careo', 'animus', 'facio', 'omnis', 'acer', 'inpatior', 'cupidus', 'silvarum', 'aptusque', 'bibo', 'fons', 'aonidus', '.']"
Juvenal,Silver,Satires,"['neque', 'enim', 'cantare', 'sub', 'antro', 'pierio', 'thyrsumque', 'potest', 'contingere', 'maesta', 'paupertas', 'atque', 'aeris', 'inops', 'quo', 'nocte', 'dieque', 'corpus', 'eget', 'satur', 'est', 'cum', 'dicit', 'horatius', 'euhoe', '!']",neque enim cantare sub antro pierio thyrsumque potest contingere maesta paupertas atque aeris inops quo nocte dieque corpus eget satur est cum dicit horatius euhoe !,"['neque', 'enim', 'canto', 'sub', 'antrum', 'pierius', 'thyrsumque', 'possum', 'contingo', 'maestus', 'paupertas', 'atque', 'aer', 'inops', 'qui', 'nox', 'dies', 'corpus', 'egeo', 'satur', 'sum', 'cum', 'dico', 'horo', 'euho', '!']"
Juvenal,Silver,Satires,"['quis', 'locus', 'ingenio', 'nisi', 'cum', 'se', 'carmine', 'solo', 'vexant', 'et', 'dominis', 'cirrhae', 'nysaeque', 'feruntur', 'pectora', 'vestra', 'duas', 'non', 'admittentia', 'curas', '?']",quis locus ingenio nisi cum se carmine solo vexant et dominis cirrhae nysaeque feruntur pectora vestra duas non admittentia curas ?,"['quis', 'locus', 'ingenium', 'nisi', 'cum', 'se', 'carmes', 'solus', 'vexant', 'et', 'dominus', 'cirrha', 'nysaequus', 'fero', 'pectora', 'vestra', 'duo', 'non', 'admitto', 'cura', '?']"
Juvenal,Silver,Satires,"['magnae', 'mentis', 'opus', 'nec', 'de', 'lodice', 'paranda', 'attonitae', 'currus', 'et', 'equos', 'faciesque', 'deorum', 'aspicere', 'et', 'qualis', 'rutulum', 'confundat', 'erinys', '.']",magnae mentis opus nec de lodice paranda attonitae currus et equos faciesque deorum aspicere et qualis rutulum confundat erinys .,"['magnus', 'mens', 'opus', 'nec', 'de', 'lodicus', 'paro', 'attonitus', 'currus', 'et', 'equus', 'facio', 'deus', 'aspicio', 'et', 'qualis', 'rutulum', 'confundo', 'erina', '.']"
Juvenal,Silver,Satires,"['nam', 'si', 'vergilio', 'puer', 'et', 'tolerabile', 'desset', 'hospitium', 'caderent', 'omnes', 'a', 'crinibus', 'hydri', 'surda', 'nihil', 'gemeret', 'grave', 'bucina', 'poscimus', 'ut', 'sit', 'non', 'minor', 'antiquo', 'rubrenus', 'lappa', 'cothurno', 'cuius', 'et', 'alveolos', 'et', 'laenam', 'pignerat', 'atreus', '?']",nam si vergilio puer et tolerabile desset hospitium caderent omnes a crinibus hydri surda nihil gemeret grave bucina poscimus ut sit non minor antiquo rubrenus lappa cothurno cuius et alveolos et laenam pignerat atreus ?,"['nam', 'si', 'vergilio', 'puer', 'et', 'tolerabilis', 'desso', 'hospitium', 'cado', 'omnis', 'ab', 'crinis', 'hydor', 'surdus', 'nihil', 'gemo', 'grave', 'bucinus', 'possum', 'ut', 'sum', 'non', 'paruus', 'antiquus', 'rubrenus', 'lappa', 'cothurnus', 'qui', 'et', 'alveolos', 'et', 'laena', 'pignoro', 'atreus', '?']"
Juvenal,Silver,Satires,"['non', 'habet', 'infelix', 'numitor', 'quod', 'mittat', 'amico', 'quintillae', 'quod', 'donet', 'habet', 'nec', 'defuit', 'illi', 'unde', 'emeret', 'multa', 'pascendum', 'carne', 'leonem', 'iam', 'domitum', 'constat', 'leviori', 'belua', 'sumptu', 'nimirum', 'et', 'capiunt', 'plus', 'intestina', 'poetae', '.']",non habet infelix numitor quod mittat amico quintillae quod donet habet nec defuit illi unde emeret multa pascendum carne leonem iam domitum constat leviori belua sumptu nimirum et capiunt plus intestina poetae .,"['non', 'habeo', 'infelix', 'numitor', 'quod', 'mitto', 'amicus', 'quintilla', 'quod', 'doneo', 'habeo', 'nec', 'desum', 'ille', 'unde', 'emo', 'multus', 'pasco', 'caro', 'leo', 'iam', 'domeo', 'consto', 'leviori', 'beluus', 'sumptus', 'nimer', 'et', 'capio', 'plus', 'intestinus', 'poeta', '.']"
Juvenal,Silver,Satires,"['contentus', 'fama', 'iaceat', 'lucanus', 'in', 'hortis', 'marmoreis', 'et', 'serrano', 'tenuique', 'saleio', 'gloria', 'quantalibet', 'quid', 'erit', 'si', 'gloria', 'tantum', 'est', '?']",contentus fama iaceat lucanus in hortis marmoreis et serrano tenuique saleio gloria quantalibet quid erit si gloria tantum est ?,"['contineo', 'fama', 'iaceo', 'luco', 'in', 'hor', 'marmoreus', 'et', 'serranus', 'tenuique', 'saleio', 'gloria', 'quantuslibet', 'quis', 'sum', 'si', 'gloria', 'tantum', 'sum', '?']"
Juvenal,Silver,Satires,"['curritur', 'ad', 'vocem', 'iucundam', 'et', 'carmen', 'amicae', 'thebaidos', 'laetam', 'cum', 'fecit', 'statius', 'urbem', 'promisitque', 'diem', 'tanta', 'dulcedine', 'captos', 'adficit', 'ille', 'animos', 'tantaque', 'libidine', 'volgi', 'auditur', 'sed', 'cum', 'fregit', 'subsellia', 'versu', 'esurit', 'intactam', 'paridi', 'nisi', 'vendit', 'agauen', '.']",curritur ad vocem iucundam et carmen amicae thebaidos laetam cum fecit statius urbem promisitque diem tanta dulcedine captos adficit ille animos tantaque libidine volgi auditur sed cum fregit subsellia versu esurit intactam paridi nisi vendit agauen .,"['curro', 'ad', 'vocem', 'iucundus', 'et', 'carmen', 'amicus', 'thebaidus', 'laetus', 'cum', 'facio', 'statius', 'urbis', 'promitto', 'dies', 'tantus', 'dulcedo', 'capgo', 'adficio', 'ille', 'animus', 'tantusque', 'libido', 'volgi', 'audio', 'sed', 'cum', 'frigo', 'subsellia', 'versu', 'esurio', 'intaheg', 'paris', 'nisi', 'vendit', 'ago', '.']"
Juvenal,Silver,Satires,"['ille', 'et', 'militiae', 'multis', 'largitur', 'honorem', 'semenstri', 'digitos', 'vatum', 'circumligat', 'auro', 'quod', 'non', 'dant', 'proceres', 'dabit', 'histrio', 'tu', 'camerinos', 'et', 'baream', 'tu', 'nobilium', 'magna', 'atria', 'curas', '?']",ille et militiae multis largitur honorem semenstri digitos vatum circumligat auro quod non dant proceres dabit histrio tu camerinos et baream tu nobilium magna atria curas ?,"['ille', 'et', 'militia', 'multus', 'largior', 'honor', 'semenster', 'digitus', 'vatum', 'circumligo', 'auro', 'qui', 'non', 'do', 'proceres', 'do', 'histrius', 'tu', 'camerinus', 'et', 'barea', 'tu', 'nobilis', 'magnus', 'atria', 'cura', '?']"
Juvenal,Silver,Satires,"['praefectos', 'pelopea', 'facit', 'philomela', 'tribunos', '.']",praefectos pelopea facit philomela tribunos .,"['praefectum', 'pelopeus', 'facio', 'philomela', 'tribunus', '.']"
Juvenal,Silver,Satires,"['haut', 'tamen', 'invideas', 'vati', 'quem', 'pulpita', 'pascunt', 'quis', 'tibi', 'maecenas', 'quis', 'nunc', 'erit', 'aut', 'proculeius', 'aut', 'fabius', '?']",haut tamen invideas vati quem pulpita pascunt quis tibi maecenas quis nunc erit aut proculeius aut fabius ?,"['hic', 'tamen', 'invideas', 'vati', 'qui', 'pulpitum', 'pasco', 'quis', 'tu', 'maecena', 'quis', 'nunc', 'sum', 'aut', 'proculeis', 'aut', 'fabius', '?']"
Juvenal,Silver,Satires,"['quis', 'cotta', 'iterum', 'quis', 'lentulus', 'alter', '?']",quis cotta iterum quis lentulus alter ?,"['quis', 'cotta', 'iterum', 'quis', 'lentulus', 'alter', '?']"
Juvenal,Silver,Satires,"['tunc', 'par', 'ingenio', 'pretium', 'tunc', 'utile', 'multis', 'pallere', 'et', 'vinum', 'toto', 'nescire', 'decembri', '.']",tunc par ingenio pretium tunc utile multis pallere et vinum toto nescire decembri .,"['tunc', 'par', 'ingenium', 'pretium', 'tunc', 'utilis', 'multus', 'pallo', 'et', 'vinum', 'totus', 'nescio', 'decembrum', '.']"
Juvenal,Silver,Satires,"['vester', 'porro', 'labor', 'fecundior', 'historiarum', 'scriptores', '?']",vester porro labor fecundior historiarum scriptores ?,"['vester', 'porro', 'labor', 'fecundus', 'historia', 'scriptor', '?']"
Juvenal,Silver,Satires,"['perit', 'hic', 'plus', 'temporis', 'atque', 'olei', 'plus', '.']",perit hic plus temporis atque olei plus .,"['pereo', 'hic', 'multus', 'tempus', 'atque', 'oleum', 'multus', '.']"
Juvenal,Silver,Satires,"['nullo', 'quippe', 'modo', 'millensima', 'pagina', 'surgit', 'omnibus', 'et', 'crescit', 'multa', 'damnosa', 'papyro', 'sic', 'ingens', 'rerum', 'numerus', 'iubet', 'atque', 'operum', 'lex', '.']",nullo quippe modo millensima pagina surgit omnibus et crescit multa damnosa papyro sic ingens rerum numerus iubet atque operum lex .,"['nullus', 'quippe', 'modus', 'millensimus', 'pagina', 'surgo', 'omnis', 'et', 'cresco', 'multus', 'damnosus', 'papyr', 'sic', 'ingens', 'res', 'numerus', 'iubeo', 'atque', 'opus', 'lex', '.']"
Juvenal,Silver,Satires,"['quae', 'tamen', 'inde', 'seges', '?']",quae tamen inde seges ?,"['qui', 'tamen', 'inde', 'seg', '?']"
Juvenal,Silver,Satires,"['terrae', 'quis', 'fructus', 'apertae', '?']",terrae quis fructus apertae ?,"['terra', 'quis', 'fructus', 'aperio', '?']"
Juvenal,Silver,Satires,"['quis', 'dabit', 'historico', 'quantum', 'daret', 'acta', 'legenti', '?']",quis dabit historico quantum daret acta legenti ?,"['quis', 'do', 'historicus', 'quantum', 'do', 'ago', 'lego', '?']"
Juvenal,Silver,Satires,"['sed', 'genus', 'ignavum', 'quod', 'lecto', 'gaudet', 'et', 'umbra', '.']",sed genus ignavum quod lecto gaudet et umbra .,"['sed', 'genus', 'igna', 'qui', 'lectus', 'gaudeo', 'et', 'umbra', '.']"
Juvenal,Silver,Satires,"['dic', 'igitur', 'quid', 'causidicis', 'civilia', 'praestent', 'officia', 'et', 'magno', 'comites', 'in', 'fasce', 'libelli', '.']",dic igitur quid causidicis civilia praestent officia et magno comites in fasce libelli .,"['dico', 'igitur', 'quis', 'causidicus', 'civilia', 'praesto', 'officium', 'et', 'magnus', 'comes', 'in', 'fasce', 'libellum', '.']"
Juvenal,Silver,Satires,"['ipsi', 'magna', 'sonant', 'sed', 'tum', 'cum', 'creditor', 'audit', 'praecipue', 'vel', 'si', 'tetigit', 'latus', 'acrior', 'illo', 'qui', 'venit', 'ad', 'dubium', 'grandi', 'cum', 'codice', 'nomen', '.']",ipsi magna sonant sed tum cum creditor audit praecipue vel si tetigit latus acrior illo qui venit ad dubium grandi cum codice nomen .,"['ipse', 'magnus', 'sono', 'sed', 'tum', 'cum', 'creditor', 'audio', 'praecipue', 'vel', 'si', 'tango', 'latus', 'acrus', 'ille', 'qui', 'venit', 'ad', 'dubius', 'grandus', 'cum', 'codo', 'nomen', '.']"
Juvenal,Silver,Satires,"['tunc', 'inmensa', 'cavi', 'spirant', 'mendacia', 'folles', 'conspuiturque', 'sinus', 'veram', 'deprendere', 'messem', 'si', 'libet', 'hinc', 'centum', 'patrimonia', 'causidicorum', 'parte', 'alia', 'solum', 'russati', 'pone', 'lacertae', '.']",tunc inmensa cavi spirant mendacia folles conspuiturque sinus veram deprendere messem si libet hinc centum patrimonia causidicorum parte alia solum russati pone lacertae .,"['tunc', 'inmensus', 'cavi', 'spiro', 'mendacium', 'follis', 'conspuio', 'sinus', 'veram', 'deprendeo', 'messis', 'si', 'libeo', 'hinc', 'centum', 'pateromonium', 'causidicus', 'pars', 'alius', 'solum', 'russo', 'pono', 'lacerta', '.']"
Juvenal,Silver,Satires,"['consedere', 'duces', 'surgis', 'tu', 'pallidus', 'aiax', 'dicturus', 'dubia', 'pro', 'libertate', 'bubulco', 'iudice', 'rumpe', 'miser', 'tensum', 'iecur', 'ut', 'tibi', 'lasso', 'agantur', 'virides', 'scalarum', 'gloria', 'palmae', '.']",consedere duces surgis tu pallidus aiax dicturus dubia pro libertate bubulco iudice rumpe miser tensum iecur ut tibi lasso agantur virides scalarum gloria palmae .,"['consedo', 'dux', 'surgis', 'tu', 'pallidus', 'aiax', 'dico', 'dubius', 'pro', 'libertas', 'bubulcus', 'iudex', 'rumpo', 'miser', 'tengo', 'iecur', 'ut', 'tu', 'labor', 'ago', 'virides', 'scalarus', 'gloria', 'palma', '.']"
Juvenal,Silver,Satires,"['quod', 'vocis', 'pretium', '?']",quod vocis pretium ?,"['qui', 'vocis', 'pretium', '?']"
Juvenal,Silver,Satires,"['siccus', 'petasunculus', 'et', 'vas', 'pelamydum', 'aut', 'veteres', 'maurorum', 'epimenia', 'bulbi', 'aut', 'vinum', 'tiberi', 'devectum', 'quinque', 'lagonae', '.']",siccus petasunculus et vas pelamydum aut veteres maurorum epimenia bulbi aut vinum tiberi devectum quinque lagonae .,"['siccus', 'petasunculus', 'et', 'vas', 'pelamydus', 'aut', 'veteres', 'mauri', 'epimenis', 'bultus', 'aut', 'vinum', 'tiber', 'devectum', 'quinque', 'lago', '.']"
Juvenal,Silver,Satires,"['si', 'quater', 'egisti', 'si', 'contigit', 'aureus', 'unus', 'inde', 'cadunt', 'partes', 'ex', 'foedere', 'pragmaticorum', '.']",si quater egisti si contigit aureus unus inde cadunt partes ex foedere pragmaticorum .,"['si', 'quater', 'ago', 'si', 'contingo', 'aureus', 'unus', 'inde', 'cado', 'pars', 'ex', 'foeder', 'pragmaticus', '.']"
Juvenal,Silver,Satires,"['aemilio', 'dabitur', 'quantum', 'licet', 'et', 'melius', 'nos', 'egimus', 'huius', 'enim', 'stat', 'currus', 'aeneus', 'alti', 'quadriiuges', 'in', 'vestibulis', 'atque', 'ipse', 'feroci', 'bellatore', 'sedens', 'curvatum', 'hastile', 'minatur', 'eminus', 'et', 'statua', 'meditatur', 'proelia', 'lusca', '.']",aemilio dabitur quantum licet et melius nos egimus huius enim stat currus aeneus alti quadriiuges in vestibulis atque ipse feroci bellatore sedens curvatum hastile minatur eminus et statua meditatur proelia lusca .,"['aemilium', 'do', 'quantum', 'licet', 'et', 'melius', 'nos', 'ego', 'hic', 'enim', 'sto', 'currus', 'aeneus', 'altus', 'quadriiux', 'in', 'vestibulis', 'atque', 'ipse', 'ferox', 'bellator', 'sedeo', 'curvatum', 'hastilis', 'minor', 'eminus', 'et', 'statua', 'meditor', 'proelium', 'lusca', '.']"
Juvenal,Silver,Satires,"['sic', 'pedo', 'conturbat', 'matho', 'deficit', 'exitus', 'hic', 'est', 'tongilii', 'magno', 'cum', 'rhinocerote', 'lavari', 'qui', 'solet', 'et', 'vexat', 'lutulenta', 'balnea', 'turba', 'perque', 'forum', 'iuvenes', 'longo', 'premit', 'assere', 'maedos', 'empturus', 'pueros', 'argentum', 'murrina', 'villas', 'spondet', 'enim', 'tyrio', 'stlattaria', 'purpura', 'filo', '.']",sic pedo conturbat matho deficit exitus hic est tongilii magno cum rhinocerote lavari qui solet et vexat lutulenta balnea turba perque forum iuvenes longo premit assere maedos empturus pueros argentum murrina villas spondet enim tyrio stlattaria purpura filo .,"['sic', 'pedo', 'conturbo', 'matho', 'deficio', 'exitus', 'hic', 'sum', 'tongilius', 'magnus', 'cum', 'rhinocerote', 'lavari', 'qui', 'soleo', 'et', 'vexat', 'lutulens', 'balnea', 'turba', 'perque', 'forum', 'iuvenes', 'longus', 'premo', 'asser', 'maedus', 'empaereo', 'puer', 'argentum', 'murrinus', 'villas', 'spondeo', 'enim', 'tyrius', 'stlattarius', 'purpura', 'filius', '.']"
Juvenal,Silver,Satires,"['et', 'tamen', 'est', 'illis', 'hoc', 'utile', 'purpura', 'vendit', 'causidicum', 'vendunt', 'amethystina', 'convenit', 'illi', 'et', 'strepitu', 'et', 'facie', 'maioris', 'vivere', 'census', 'sed', 'finem', 'inpensae', 'non', 'servat', 'prodiga', 'roma', '.']",et tamen est illis hoc utile purpura vendit causidicum vendunt amethystina convenit illi et strepitu et facie maioris vivere census sed finem inpensae non servat prodiga roma .,"['et', 'tamen', 'sum', 'ille', 'hic', 'utilis', 'purpura', 'vendit', 'causidicus', 'vendunt', 'amethy', 'convenit', 'ille', 'et', 'strepitus', 'et', 'facies', 'magnus', 'vivere', 'census', 'sed', 'finis', 'inpendo', 'non', 'servat', 'prodigus', 'roma', '.']"
Juvenal,Silver,Satires,"['fidimus', 'eloquio', '?']",fidimus eloquio ?,"['facio', 'eloquio', '?']"
