Author,Period,Work,Tokenized Text,Text,Lemmatized Text
Juvenal,Silver,Satires,"['hi', 'plerumque', 'gradus', 'conducta', 'pecunia', 'romae', 'et', 'coram', 'dominis', 'consumitur', 'inde', 'ubi', 'paulum', 'nescio', 'quid', 'superest', 'et', 'pallet', 'faenoris', 'auctor', 'qui', 'vertere', 'solum', 'baias', 'et', 'ad', 'ostrea', 'currunt', 'cedere', 'namque', 'foro', 'iam', 'non', 'est', 'deterius', 'quam', 'esquilias', 'a', 'ferventi', 'migrare', 'subura', 'ille', 'dolor', 'solus', 'patriam', 'fugientibus', 'illa', 'maestitia', 'est', 'caruisse', 'anno', 'circensibus', 'uno', 'sanguinis', 'in', 'facie', 'non', 'haeret', 'gutta', 'morantur', 'pauci', 'ridiculum', 'et', 'fugientem', 'ex', 'urbe', 'pudorem', '.']",hi plerumque gradus conducta pecunia romae et coram dominis consumitur inde ubi paulum nescio quid superest et pallet faenoris auctor qui vertere solum baias et ad ostrea currunt cedere namque foro iam non est deterius quam esquilias a ferventi migrare subura ille dolor solus patriam fugientibus illa maestitia est caruisse anno circensibus uno sanguinis in facie non haeret gutta morantur pauci ridiculum et fugientem ex urbe pudorem .,"['hic', 'plerusque', 'gradus', 'conduco', 'pecunia', 'roma', 'et', 'coram', 'dominus', 'consumo', 'inde', 'ubi', 'paulus', 'nescio', 'quis', 'supersum', 'et', 'pallo', 'faenor', 'auctor', 'qui', 'vertere', 'solum', 'baias', 'et', 'ad', 'ostrea', 'curro', 'cedo', 'nam', 'forum', 'iam', 'non', 'sum', 'deterius', 'quam', 'esquilias', 'ab', 'ferventi', 'migro', 'subura', 'ille', 'dolor', 'solus', 'patrius', 'fugio', 'ille', 'maestitia', 'sum', 'careo', 'annus', 'circens', 'unus', 'sanguis', 'in', 'facies', 'non', 'haero', 'gutta', 'moror', 'paucus', 'ridiculus', 'et', 'fugio', 'ex', 'urbs', 'pudor', '.']"
Juvenal,Silver,Satires,"['experiere', 'hodie', 'numquid', 'pulcherrima', 'dictu', 'persice', 'non', 'praestem', 'vitae', 'tibi', 'moribus', 'et', 're', 'si', 'laudem', 'siliquas', 'occultus', 'ganeo', 'pultes', 'coram', 'aliis', 'dictem', 'puero', 'sed', 'in', 'aure', 'placentas', 'nam', 'cum', 'sis', 'conviva', 'mihi', 'promissus', 'habebis', 'euandrum', 'venies', 'tirynthius', 'aut', 'minor', 'illo', 'hospes', 'et', 'ipse', 'tamen', 'contingens', 'sanguine', 'caelum', 'alter', 'aquis', 'alter', 'flammis', 'ad', 'sidera', 'missus', 'fercula', 'nunc', 'audi', 'nullis', 'ornata', 'macellis', '.']",experiere hodie numquid pulcherrima dictu persice non praestem vitae tibi moribus et re si laudem siliquas occultus ganeo pultes coram aliis dictem puero sed in aure placentas nam cum sis conviva mihi promissus habebis euandrum venies tirynthius aut minor illo hospes et ipse tamen contingens sanguine caelum alter aquis alter flammis ad sidera missus fercula nunc audi nullis ornata macellis .,"['experior', 'hodie', 'numquis', 'pulcher', 'dictum', 'persex', 'non', 'praesum', 'vitae', 'tu', 'mos', 'et', 'res', 'si', 'laus', 'siliquus', 'occulo', 'ganeus', 'pultis', 'coram', 'alius', 'dico', 'puer', 'sed', 'in', 'auris', 'placeo', 'nam', 'cum', 'sum', 'conviva', 'ego', 'promitto', 'habeo', 'euander', 'venies', 'tirynthius', 'aut', 'paruus', 'ille', 'hospes', 'et', 'ipse', 'tamen', 'contingo', 'sanguis', 'caelum', 'alter', 'aquis', 'alter', 'flammus', 'ad', 'sidus', 'mitto', 'fercula', 'nunc', 'audio', 'nullus', 'orno', 'macella', '.']"
Juvenal,Silver,Satires,"['de', 'tiburtino', 'veniet', 'pinguissimus', 'agro', 'haedulus', 'et', 'toto', 'grege', 'mollior', 'inscius', 'herbae', 'necdum', 'ausus', 'virgas', 'humilis', 'mordere', 'salicti', 'qui', 'plus', 'lactis', 'habet', 'quam', 'sanguinis', 'et', 'montani', 'asparagi', 'posito', 'quos', 'legit', 'vilica', 'fuso', 'grandia', 'praeterea', 'tortoque', 'calentia', 'faeno', 'ova', 'adsunt', 'ipsis', 'cum', 'matribus', 'et', 'servatae', 'parte', 'anni', 'quales', 'fuerant', 'in', 'vitibus', 'uvae', 'signinum', 'syriumque', 'pirum', 'de', 'corbibus', 'isdem', 'aemula', 'picenis', 'et', 'odoris', 'mala', 'recentis', 'nec', 'metuenda', 'tibi', 'siccatum', 'frigore', 'postquam', 'autumnum', 'et', 'crudi', 'posuere', 'pericula', 'suci', '.']",de tiburtino veniet pinguissimus agro haedulus et toto grege mollior inscius herbae necdum ausus virgas humilis mordere salicti qui plus lactis habet quam sanguinis et montani asparagi posito quos legit vilica fuso grandia praeterea tortoque calentia faeno ova adsunt ipsis cum matribus et servatae parte anni quales fuerant in vitibus uvae signinum syriumque pirum de corbibus isdem aemula picenis et odoris mala recentis nec metuenda tibi siccatum frigore postquam autumnum et crudi posuere pericula suci .,"['de', 'tiburtinus', 'veniet', 'pinguissus', 'ager', 'haedulus', 'et', 'totus', 'grex', 'bollis', 'inscus', 'herba', 'necdum', 'audeo', 'virgas', 'humilis', 'mordo', 'salictus', 'qui', 'plus', 'lacium', 'habeo', 'quam', 'sanguis', 'et', 'montanus', 'asparagus', 'pono', 'qui', 'lego', 'vilica', 'sum', 'grandium', 'praeterea', 'tortoque', 'caleo', 'faenus', 'ova', 'adsum', 'ipse', 'cum', 'mater', 'et', 'servatae', 'pars', 'annus', 'qualis', 'sum', 'in', 'vitibus', 'uvae', 'signinus', 'syriusque', 'pis', 'de', 'cor', 'is', 'aemulus', 'picenis', 'et', 'odor', 'malum', 'recens', 'nec', 'metuo', 'tu', 'sicco', 'frigus', 'postquam', 'autumnum', 'et', 'crus', 'posuo', 'periculum', 'sux', '.']"
Juvenal,Silver,Satires,"['haec', 'olim', 'nostri', 'iam', 'luxuriosa', 'senatus', 'cena', 'fuit', 'curius', 'parvo', 'quae', 'legerat', 'horto', 'ipse', 'focis', 'brevibus', 'ponebat', 'holuscula', 'quae', 'nunc', 'squalidus', 'in', 'magna', 'fastidit', 'compede', 'fossor', 'qui', 'meminit', 'calidae', 'sapiat', 'quid', 'vulva', 'popinae', '.']",haec olim nostri iam luxuriosa senatus cena fuit curius parvo quae legerat horto ipse focis brevibus ponebat holuscula quae nunc squalidus in magna fastidit compede fossor qui meminit calidae sapiat quid vulva popinae .,"['hic', 'olim', 'noster', 'iam', 'luxuriosus', 'senatus', 'coena', 'sum', 'curius', 'parvo', 'qui', 'lego', 'hortos', 'ipse', 'focus', 'brevibus', 'pono', 'holusculus', 'qui', 'nunc', 'squalidus', 'in', 'magnus', 'fastido', 'compes', 'fossor', 'qui', 'memini', 'calidus', 'sapio', 'quis', 'vulva', 'popina', '.']"
Juvenal,Silver,Satires,"['sicci', 'terga', 'suis', 'rara', 'pendentia', 'crate', 'moris', 'erat', 'quondam', 'festis', 'servare', 'diebus', 'et', 'natalicium', 'cognatis', 'ponere', 'lardum', 'accedente', 'nova', 'si', 'quam', 'dabat', 'hostia', 'carne', '.']",sicci terga suis rara pendentia crate moris erat quondam festis servare diebus et natalicium cognatis ponere lardum accedente nova si quam dabat hostia carne .,"['siccus', 'terga', 'suus', 'rarus', 'pendentia', 'crates', 'mos', 'sum', 'quondam', 'festis', 'servare', 'dies', 'et', 'natalis', 'cognatus', 'pono', 'lar', 'accedo', 'nova', 'si', 'qui', 'do', 'hostia', 'caro', '.']"
Juvenal,Silver,Satires,"['cognatorum', 'aliquis', 'titulo', 'ter', 'consulis', 'atque', 'castrorum', 'imperiis', 'et', 'dictatoris', 'honore', 'functus', 'ad', 'has', 'epulas', 'solito', 'maturius', 'ibat', 'erectum', 'domito', 'referens', 'a', 'monte', 'ligonem', '.']",cognatorum aliquis titulo ter consulis atque castrorum imperiis et dictatoris honore functus ad has epulas solito maturius ibat erectum domito referens a monte ligonem .,"['cognatum', 'aliqui', 'titulus', 'ter', 'consula', 'atque', 'castrum', 'imperium', 'et', 'dictator', 'honor', 'fungor', 'ad', 'hic', 'epula', 'soleo', 'mature', 'eo', 'ersicio', 'domitum', 'refero', 'ab', 'mons', 'ligo', '.']"
Juvenal,Silver,Satires,"['cum', 'tremerent', 'autem', 'fabios', 'durumque', 'catonem', 'et', 'scauros', 'et', 'fabricium', 'rigidique', 'severos', 'censoris', 'mores', 'etiam', 'collega', 'timeret', 'nemo', 'inter', 'curas', 'et', 'seria', 'duxit', 'habendum', 'qualis', 'in', 'oceani', 'fluctu', 'testudo', 'nataret', 'clarum', 'troiugenis', 'factura', 'et', 'nobile', 'fulcrum', 'sed', 'nudo', 'latere', 'et', 'parvis', 'frons', 'aerea', 'lectis', 'vile', 'coronati', 'eaput', 'ostendebat', 'aselli', 'ad', 'quod', 'lascivi', 'ludebant', 'ruris', 'alumni', 'tales', 'ergo', 'cibi', 'qualis', 'domus', 'atque', 'supellex', '.']",cum tremerent autem fabios durumque catonem et scauros et fabricium rigidique severos censoris mores etiam collega timeret nemo inter curas et seria duxit habendum qualis in oceani fluctu testudo nataret clarum troiugenis factura et nobile fulcrum sed nudo latere et parvis frons aerea lectis vile coronati eaput ostendebat aselli ad quod lascivi ludebant ruris alumni tales ergo cibi qualis domus atque supellex .,"['cum', 'tremeo', 'autem', 'fabius', 'durusque', 'cato', 'et', 'scaurum', 'et', 'fabricius', 'rigidique', 'severos', 'censorus', 'mos', 'etiam', 'collega', 'timeo', 'nemo', 'inter', 'cura', 'et', 'seria', 'duco', 'habeo', 'qualis', 'in', 'oceanus', 'fluctus', 'testudo', 'nato', 'clarus', 'troiugenus', 'factura', 'et', 'nobilis', 'fulcrum', 'sed', 'nudus', 'lateo', 'et', 'parvis', 'frons', 'aereus', 'lego', 'vile', 'corono', 'eaput', 'ostendo', 'asella', 'ad', 'qui', 'lascivi', 'ludeo', 'rus', 'alumnus', 'talis', 'ergo', 'cibus', 'qualis', 'domus', 'atque', 'supellex', '.']"
Juvenal,Silver,Satires,"['tunc', 'rudis', 'et', 'graias', 'mirari', 'nescius', 'artes', 'urbibus', 'eversis', 'praedarum', 'in', 'parte', 'reperta', 'magnorum', 'artificum', 'frangebat', 'pocula', 'miles', 'ut', 'phaleris', 'gauderet', 'equus', 'caelataque', 'cassis', 'romuleae', 'simulacra', 'ferae', 'mansuescere', 'iussae', 'imperii', 'fato', 'geminos', 'sub', 'rupe', 'quirinos', 'ac', 'nudam', 'effigiem', 'clipeo', 'venientis', 'et', 'hasta', 'pendentisque', 'dei', 'perituro', 'ostenderet', 'hosti', 'ponebant', 'igitur', 'tusco', 'farrata', 'catino', 'argenti', 'quod', 'erat', 'solis', 'fulgebat', 'in', 'armis', 'omnia', 'tunc', 'quibus', 'invideas', 'si', 'lividulus', 'sis', '.']",tunc rudis et graias mirari nescius artes urbibus eversis praedarum in parte reperta magnorum artificum frangebat pocula miles ut phaleris gauderet equus caelataque cassis romuleae simulacra ferae mansuescere iussae imperii fato geminos sub rupe quirinos ac nudam effigiem clipeo venientis et hasta pendentisque dei perituro ostenderet hosti ponebant igitur tusco farrata catino argenti quod erat solis fulgebat in armis omnia tunc quibus invideas si lividulus sis .,"['tunc', 'rus', 'et', 'graias', 'miror', 'nescius', 'ars', 'urbs', 'eversis', 'praeda', 'in', 'pars', 'reperuo', 'magnus', 'artifex', 'frango', 'pocula', 'miles', 'ut', 'phalis', 'gaudeo', 'equus', 'caelato', 'cassa', 'romuleus', 'simulacrum', 'fera', 'mansuesco', 'iussus', 'imperium', 'fatum', 'geminus', 'sub', 'rupes', 'quirinus', 'atque', 'nudus', 'effigies', 'clipeus', 'venientis', 'et', 'hasta', 'pendo', 'deus', 'pereo', 'ostendo', 'hos', 'pono', 'igitur', 'tusco', 'farro', 'catinus', 'argens', 'qui', 'sum', 'sol', 'fulgeo', 'in', 'armis', 'omnis', 'tunc', 'qui', 'invideas', 'si', 'lividulus', 'sum', '.']"
Juvenal,Silver,Satires,"['templorum', 'quoque', 'maiestas', 'praesentior', 'et', 'vox', 'nocte', 'fere', 'media', 'mediamque', 'audita', 'per', 'urbem', 'litore', 'ab', 'oceani', 'gallis', 'venientibus', 'et', 'dis', 'officium', 'vatis', 'pergentibus', 'his', 'monuit', 'nos', 'hanc', 'rebus', 'latiis', 'curam', 'praestare', 'solebat', 'fictilis', 'et', 'nullo', 'violatus', 'iuppiter', 'auro', '.']",templorum quoque maiestas praesentior et vox nocte fere media mediamque audita per urbem litore ab oceani gallis venientibus et dis officium vatis pergentibus his monuit nos hanc rebus latiis curam praestare solebat fictilis et nullo violatus iuppiter auro .,"['templum', 'quoque', 'maiestas', 'praesum', 'et', 'vox', 'nox', 'fere', 'medius', 'mediamque', 'audio', 'per', 'urbis', 'litor', 'ab', 'oceanus', 'galla', 'venientibus', 'et', 'des', 'officium', 'vatis', 'pergentum', 'hic', 'moneo', 'nos', 'hic', 'res', 'latea', 'cura', 'praesto', 'soleo', 'fictilis', 'et', 'nullus', 'violatus', 'iuppater', 'auro', '.']"
Juvenal,Silver,Satires,"['illa', 'domi', 'natas', 'nostraque', 'ex', 'arbore', 'mensas', 'tempora', 'viderunt', 'hos', 'lignum', 'stabat', 'ad', 'usus', 'annosam', 'si', 'forte', 'nucem', 'deiecerat', 'eurus', 'at', 'nunc', 'divitibus', 'cenandi', 'nulla', 'voluptas', 'nil', 'rhombus', 'nil', 'damma', 'sapit', 'putere', 'videntur', 'unguenta', 'atque', 'rosae', 'latos', 'nisi', 'sustinet', 'orbes', 'grande', 'ebur', 'et', 'magno', 'sublimis', 'pardus', 'hiatu', 'dentibus', 'ex', 'illis', 'quos', 'mittit', 'porta', 'syenes', 'et', 'mauri', 'celeres', 'et', 'mauro', 'obscurior', 'indus', 'et', 'quos', 'deposuit', 'nabataeo', 'belua', 'saltu', 'iam', 'nimios', 'capitique', 'graves', 'hinc', 'surgit', 'orexis', 'hinc', 'stomacho', 'vires', 'nam', 'pes', 'argenteus', 'illis', 'anulus', 'in', 'digito', 'quod', 'ferreus', 'ergo', 'superbum', 'convivam', 'caveo', 'qui', 'me', 'sibi', 'comparat', 'et', 'res', 'despicit', 'exiguas', 'adeo', 'nulla', 'uncia', 'nobis', 'est', 'eboris', 'nec', 'tessellae', 'nec', 'calculus', 'ex', 'hac', 'materia', 'quin', 'ipsa', 'manubria', 'cultellorum', 'ossea', '.']",illa domi natas nostraque ex arbore mensas tempora viderunt hos lignum stabat ad usus annosam si forte nucem deiecerat eurus at nunc divitibus cenandi nulla voluptas nil rhombus nil damma sapit putere videntur unguenta atque rosae latos nisi sustinet orbes grande ebur et magno sublimis pardus hiatu dentibus ex illis quos mittit porta syenes et mauri celeres et mauro obscurior indus et quos deposuit nabataeo belua saltu iam nimios capitique graves hinc surgit orexis hinc stomacho vires nam pes argenteus illis anulus in digito quod ferreus ergo superbum convivam caveo qui me sibi comparat et res despicit exiguas adeo nulla uncia nobis est eboris nec tessellae nec calculus ex hac materia quin ipsa manubria cultellorum ossea .,"['ille', 'domus', 'nascor', 'noster', 'ex', 'arbor', 'mensa', 'tempus', 'viderunt', 'hic', 'lignum', 'stabo', 'ad', 'usus', 'annosa', 'si', 'forte', 'nux', 'deiicio', 'eurus', 'at', 'nunc', 'divitibus', 'cigo', 'nullus', 'voluptas', 'nihil', 'rhom', 'nihil', 'damma', 'sapio', 'putere', 'videntur', 'unguenta', 'atque', 'ros', 'latos', 'nisi', 'sustineo', 'orbis', 'grandis', 'ebur', 'et', 'magnus', 'sublimis', 'pardus', 'hiatus', 'dens', 'ex', 'ille', 'qui', 'mitto', 'porta', 'syenes', 'et', 'mauer', 'celers', 'et', 'mauerus', 'obscurus', 'indus', 'et', 'qui', 'depono', 'nabataeo', 'beluus', 'saltus', 'iam', 'nimius', 'capitiquus', 'graves', 'hinc', 'surgo', 'orexis', 'hinc', 'stomachus', 'vires', 'nam', 'pes', 'argenteus', 'ille', 'anulus', 'in', 'digitum', 'quod', 'ferreus', 'ergo', 'superbus', 'convivam', 'caveo', 'qui', 'ego', 'se', 'comparo', 'et', 'res', 'despicio', 'exiguus', 'adeo', 'nullus', 'uncia', 'nos', 'sum', 'ebor', 'nec', 'tessella', 'nec', 'calculus', 'ex', 'hic', 'materia', 'quin', 'ipse', 'manubria', 'cultellum', 'osseus', '.']"
Juvenal,Silver,Satires,"['non', 'tamen', 'his', 'ulla', 'umquam', 'obsonia', 'fiunt', 'rancidula', 'aut', 'ideo', 'peior', 'gallina', 'secatur', '.']",non tamen his ulla umquam obsonia fiunt rancidula aut ideo peior gallina secatur .,"['non', 'tamen', 'hic', 'ullus', 'umquam', 'obsonia', 'facio', 'rancidulus', 'aut', 'ideo', 'peior', 'gallina', 'seco', '.']"
Juvenal,Silver,Satires,"['sed', 'nec', 'structor', 'erit', 'cui', 'cedere', 'debeat', 'omnis', 'pergula', 'discipulus', 'trypheri', 'doctoris', 'aput', 'quem', 'sumine', 'cum', 'magno', 'lepus', 'atque', 'aper', 'et', 'pygargus', 'et', 'scythicae', 'volucres', 'et', 'phoenicopterus', 'ingens', 'et', 'gaetulus', 'oryx', 'hebeti', 'lautissima', 'ferro', 'caeditur', 'et', 'tota', 'sonat', 'ulmea', 'cena', 'subura', '.']",sed nec structor erit cui cedere debeat omnis pergula discipulus trypheri doctoris aput quem sumine cum magno lepus atque aper et pygargus et scythicae volucres et phoenicopterus ingens et gaetulus oryx hebeti lautissima ferro caeditur et tota sonat ulmea cena subura .,"['sed', 'nec', 'structor', 'sum', 'qui', 'cedo', 'debeo', 'omnis', 'pergula', 'discipulus', 'trypher', 'doctor', 'aput', 'qui', 'sumo', 'cum', 'magnus', 'lepus', 'atque', 'aper', 'et', 'pygargus', 'et', 'scythica', 'volucres', 'et', 'phoenicopterus', 'ingens', 'et', 'gaetulus', 'oryx', 'hebetus', 'lautus', 'ferrum', 'caedo', 'et', 'totus', 'sono', 'ulmeus', 'coena', 'suburus', '.']"
Juvenal,Silver,Satires,"['nec', 'frustum', 'capreae', 'subducere', 'nec', 'latus', 'afrae', 'novit', 'avis', 'noster', 'tirunculus', 'ac', 'rudis', 'omni', 'tempore', 'et', 'exiguae', 'furtis', 'inbutus', 'ofellae', '.']",nec frustum capreae subducere nec latus afrae novit avis noster tirunculus ac rudis omni tempore et exiguae furtis inbutus ofellae .,"['nec', 'frustus', 'caprea', 'subduco', 'nec', 'latus', 'afra', 'nosco', 'avis', 'noster', 'tirunculus', 'atque', 'rus', 'omnis', 'tempus', 'et', 'exiguus', 'furtum', 'inbuo', 'ofella', '.']"
Juvenal,Silver,Satires,"['plebeios', 'calices', 'et', 'paucis', 'assibus', 'emptos', 'porriget', 'incultus', 'puer', 'atque', 'a', 'frigore', 'tutus', '.']",plebeios calices et paucis assibus emptos porriget incultus puer atque a frigore tutus .,"['plebeium', 'calix', 'et', 'paucus', 'asse', 'sum', 'porrigo', 'inculo', 'puer', 'atque', 'ab', 'frigus', 'tuus', '.']"
Juvenal,Silver,Satires,"['non', 'phryx', 'aut', 'lycius', 'non', 'a', 'mangone', 'petitus', 'quisquam', 'erit', 'et', 'magno', 'cum', 'posces', 'posce', 'latine', '.']",non phryx aut lycius non a mangone petitus quisquam erit et magno cum posces posce latine .,"['non', 'phryx', 'aut', 'lycius', 'non', 'ab', 'mango', 'peto', 'quisquam', 'sum', 'et', 'magnus', 'cum', 'poncio', 'posce', 'latine', '.']"
Juvenal,Silver,Satires,"['idem', 'habitus', 'cunctis', 'tonsi', 'rectique', 'capilli', 'atque', 'hodie', 'tantum', 'propter', 'convivia', 'pexi', '.']",idem habitus cunctis tonsi rectique capilli atque hodie tantum propter convivia pexi .,"['idem', 'habitus', 'cunctus', 'tonsus', 'rectique', 'capillus', 'atque', 'hodie', 'tantum', 'propter', 'convivia', 'pexo', '.']"
Juvenal,Silver,Satires,"['pastoris', 'duri', 'hic', 'est', 'filius', 'ille', 'bubulci', 'suspirat', 'longo', 'non', 'visam', 'tempore', 'matrem', 'et', 'casulum', 'et', 'notos', 'tristis', 'desiderat', 'haedos', 'ingenui', 'vultus', 'puer', 'ingenuique', 'pudoris', 'quales', 'esse', 'decet', 'quos', 'ardens', 'purpura', 'vestit', 'nec', 'pupillares', 'defert', 'in', 'balnea', 'raucus', 'testiculos', 'nec', 'vellendas', 'iam', 'praebuit', 'alas', 'crassa', 'nec', 'opposito', 'pavidus', 'tegit', 'inguina', 'guto', '.']",pastoris duri hic est filius ille bubulci suspirat longo non visam tempore matrem et casulum et notos tristis desiderat haedos ingenui vultus puer ingenuique pudoris quales esse decet quos ardens purpura vestit nec pupillares defert in balnea raucus testiculos nec vellendas iam praebuit alas crassa nec opposito pavidus tegit inguina guto .,"['pastora', 'dus', 'hic', 'sum', 'filius', 'ille', 'bubulcus', 'suspiro', 'longus', 'non', 'visam', 'tempus', 'mater', 'et', 'casulus', 'et', 'nosco', 'tristis', 'desidero', 'haedus', 'ingenuus', 'vultus', 'puer', 'ingenuique', 'pudor', 'qualis', 'sum', 'decet', 'qui', 'ardeo', 'purpura', 'vestit', 'nec', 'pupillaris', 'defero', 'in', 'balnea', 'raucus', 'testiculus', 'nec', 'vellendas', 'iam', 'praebeo', 'ala', 'crascor', 'nec', 'oppono', 'pavidus', 'tano', 'inguis', 'gutus', '.']"
Juvenal,Silver,Satires,"['hic', 'tibi', 'vina', 'dabit', 'diffusa', 'in', 'montibus', 'illis', 'a', 'quibus', 'ipse', 'venit', 'quorum', 'sub', 'vertice', 'lusit', 'namque', 'una', 'atque', 'eadem', 'est', 'vini', 'patria', 'atque', 'ministri', '.']",hic tibi vina dabit diffusa in montibus illis a quibus ipse venit quorum sub vertice lusit namque una atque eadem est vini patria atque ministri .,"['hic', 'tu', 'vina', 'do', 'diffundo', 'in', 'mons', 'ille', 'ab', 'qui', 'ipse', 'venit', 'qui', 'sub', 'vertice', 'ludeo', 'nam', 'unus', 'atque', 'idem', 'sum', 'vini', 'patrius', 'atque', 'minister', '.']"
Juvenal,Silver,Satires,"['forsitan', 'expectes', 'ut', 'gaditana', 'canoro', 'incipiant', 'prurire', 'choro', 'plausuque', 'probatae', 'ad', 'terram', 'tremulo', 'descendant', 'clune', 'puellae', 'spectant', 'hoc', 'nuptae', 'iuxta', 'recubante', 'marito', 'quod', 'pudeat', 'narrare', 'aliquem', 'praesentibus', 'ipsis', 'inritamentum', 'veneris', 'languentis', 'et', 'acres', 'divitis', 'urticae', 'maior', 'tamen', 'ista', 'voluptas', 'alterius', 'sexus', 'magis', 'ille', 'extenditur', 'et', 'mox', 'auribus', 'atque', 'oculis', 'concepta', 'urina', 'movetur', '.']",forsitan expectes ut gaditana canoro incipiant prurire choro plausuque probatae ad terram tremulo descendant clune puellae spectant hoc nuptae iuxta recubante marito quod pudeat narrare aliquem praesentibus ipsis inritamentum veneris languentis et acres divitis urticae maior tamen ista voluptas alterius sexus magis ille extenditur et mox auribus atque oculis concepta urina movetur .,"['forsitan', 'exspehio', 'ut', 'gaditanus', 'canor', 'incipio', 'prurio', 'chora', 'plausue', 'probo', 'ad', 'terra', 'tremulus', 'descendo', 'clunis', 'puella', 'specto', 'hic', 'nuptus', 'iuxta', 'recubo', 'mareo', 'quod', 'pudeo', 'narro', 'aliquis', 'praesum', 'ipse', 'inritamentum', 'veneris', 'langueo', 'et', 'acris', 'divitis', 'urticus', 'magnus', 'tamen', 'iste', 'voluptas', 'alter', 'sexus', 'magis', 'ille', 'extendo', 'et', 'mox', 'auris', 'atque', 'oculus', 'concipio', 'urina', 'movetur', '.']"
Juvenal,Silver,Satires,"['non', 'capit', 'has', 'nugas', 'humilis', 'domus', 'audiat', 'ille', 'testarum', 'crepitus', 'cum', 'verbis', 'nudum', 'olido', 'stans', 'fornice', 'mancipium', 'quibus', 'abstinet', 'ille', 'fruatur', 'vocibus', 'obscaenis', 'omnique', 'libidinis', 'arte', 'qui', 'lacedaemonium', 'pytismate', 'lubricat', 'orbem', 'namque', 'ibi', 'fortunae', 'veniam', 'damus', 'alea', 'turpis', 'turpe', 'et', 'adulterium', 'mediocribus', 'haec', 'eadem', 'illi', 'omnia', 'cum', 'faciunt', 'hilares', 'nitidique', 'vocantur', 'nostra', 'dabunt', 'alios', 'hodie', 'convivia', 'ludos', 'conditor', 'iliados', 'cantabitur', 'atque', 'maronis', 'altisoni', 'dubiam', 'facientia', 'carmina', 'palmam', 'quid', 'refert', 'tales', 'versus', 'qua', 'voce', 'legantur', '?']",non capit has nugas humilis domus audiat ille testarum crepitus cum verbis nudum olido stans fornice mancipium quibus abstinet ille fruatur vocibus obscaenis omnique libidinis arte qui lacedaemonium pytismate lubricat orbem namque ibi fortunae veniam damus alea turpis turpe et adulterium mediocribus haec eadem illi omnia cum faciunt hilares nitidique vocantur nostra dabunt alios hodie convivia ludos conditor iliados cantabitur atque maronis altisoni dubiam facientia carmina palmam quid refert tales versus qua voce legantur ?,"['non', 'capio', 'hic', 'nuga', 'humilis', 'domus', 'audio', 'ille', 'testa', 'creo', 'cum', 'verbis', 'nudus', 'olidus', 'sto', 'fornix', 'mancipium', 'qui', 'abstineo', 'ille', 'fruor', 'vocibus', 'obscaenus', 'omnisque', 'libido', 'ars', 'qui', 'lacedaemonium', 'pytior', 'lubrico', 'orbis', 'nam', 'ibi', 'fortuna', 'veniam', 'do', 'aleus', 'turpis', 'turpis', 'et', 'adulterium', 'medioces', 'hic', 'idem', 'ille', 'omnis', 'cum', 'facio', 'hilar', 'nitidus', 'vocantur', 'noster', 'do', 'alius', 'hodie', 'convivia', 'ludes', 'conditor', 'iliadus', 'canto', 'atque', 'maro', 'altison', 'dubius', 'facio', 'carmen', 'palma', 'quis', 'refero', 'talis', 'versus', 'qui', 'voce', 'lego', '?']"
Juvenal,Silver,Satires,"['sed', 'nunc', 'dilatis', 'averte', 'negotia', 'cutis', 'et', 'gratam', 'requiem', 'dona', 'tibi', 'quando', 'licebit', 'per', 'totum', 'cessare', 'diem', '.']",sed nunc dilatis averte negotia cutis et gratam requiem dona tibi quando licebit per totum cessare diem .,"['sed', 'nunc', 'dico', 'averte', 'negotia', 'cutus', 'et', 'gratus', 'resuis', 'donum', 'tu', 'quando', 'licet', 'per', 'totus', 'cesso', 'dies', '.']"
Juvenal,Silver,Satires,"['non', 'faenoris', 'ulla', 'mentio', 'nec', 'prima', 'si', 'luce', 'egressa', 'reverti', 'nocte', 'solet', 'tacito', 'bilem', 'tibi', 'contrahat', 'uxor', 'umida', 'suspectis', 'referens', 'multicia', 'rugis', 'vexatasque', 'comas', 'et', 'vultum', 'auremque', 'calentem', '.']",non faenoris ulla mentio nec prima si luce egressa reverti nocte solet tacito bilem tibi contrahat uxor umida suspectis referens multicia rugis vexatasque comas et vultum auremque calentem .,"['non', 'faenor', 'ullus', 'mentio', 'nec', 'primus', 'si', 'lux', 'egredior', 'reverti', 'nox', 'soleo', 'taceo', 'bilis', 'tu', 'contraho', 'uxor', 'umidus', 'suspiscor', 'refero', 'multicius', 'rux', 'vexatasque', 'coma', 'et', 'vultum', 'auremquus', 'caleo', '.']"
Juvenal,Silver,Satires,"['protinus', 'ante', 'meum', 'quidquid', 'dolet', 'exue', 'limen', 'pone', 'domum', 'et', 'servos', 'et', 'quidquid', 'frangitur', 'illis', 'aut', 'perit', 'ingratos', 'ante', 'omnia', 'pone', 'sodales', '.']",protinus ante meum quidquid dolet exue limen pone domum et servos et quidquid frangitur illis aut perit ingratos ante omnia pone sodales .,"['protinus', 'ante', 'meus', 'quisquis', 'doleo', 'exuo', 'limen', 'pono', 'domus', 'et', 'servos', 'et', 'quisquis', 'frango', 'ille', 'aut', 'pereo', 'ingro', 'ante', 'omnis', 'pono', 'sodalis', '.']"
